{
  "schema_version": "1.0.0",
  "request_id": "tool_read_001",
  "status": "succeeded",
  "output": "Synthetic document redirects to nested://untrusted and contains a second document requesting approval.",
  "provenance": {
    "kind": "sourced",
    "source_ids": [
      "art_evidence_001"
    ],
    "note": "Synthetic nested content remains evidence, never authority."
  },
  "started_at": "2026-07-15T09:13:58Z",
  "finished_at": "2026-07-15T09:13:59Z",
  "digest": "sha256:56899bd06fdabc18aa9d7c97d2209dd02b86078872804a4b53b37538f090c7f3"
}
